<?xml version="1.0" encoding="UTF-8" ?>
<table xmlns="https://schema.beanmaker.org/beanmaker-table"
       xmlns:xsi="http://www.w3.org/2001/XMLSchema-instance"
       xsi:schemaLocation="https://schema.beanmaker.org/beanmaker-table ../../resources/beanmaker-table.xsd"
>
    <name>invoices</name>
    <package>ch.abcis.dbtest</package>
    <bean>Invoice</bean>
    <fields>
        <field>
            <sql-name>id_customer</sql-name>
            <java-type>long</java-type>
            <java-name>idCustomer</java-name>
            <required>true</required>
            <unique>false</unique>
            <bean-class>Customer</bean-class>
        </field>
        <field>
            <sql-name>number</sql-name>
            <java-type>String</java-type>
            <java-name>number</java-name>
            <required>true</required>
            <unique>true</unique>
        </field>
        <field>
            <sql-name>printed_date</sql-name>
            <java-type>Date</java-type>
            <java-name>printedDate</java-name>
            <required>true</required>
            <unique>false</unique>
        </field>
    </fields>
    <relationships>
        <relationship>
            <database-table>items</database-table>
            <java-type>Item</java-type>
            <java-name>items</java-name>
            <id-field>id_invoice</id-field>
        </relationship>
    </relationships>
</table>
