<?xml version="1.0" encoding="UTF-8" ?>
<table xmlns="https://schema.beanmaker.org/beanmaker-table"
       xmlns:xsi="http://www.w3.org/2001/XMLSchema-instance"
       xsi:schemaLocation="https://schema.beanmaker.org/beanmaker-table ../../resources/beanmaker-table.xsd"
>
    <name>categories</name>
    <package>ch.abcis.dbtest</package>
    <bean>Category</bean>
    <fields>
        <field>
            <sql-name>id_label</sql-name>
            <java-type>long</java-type>
            <java-name>idLabel</java-name>
            <required>true</required>
            <unique>false</unique>
            <bean-class>DbBeanLabel</bean-class>
        </field>
    </fields>
    <relationships>
        <relationship>
            <database-table>products</database-table>
            <java-type>Product</java-type>
            <java-name>products</java-name>
            <id-field>id_category</id-field>
        </relationship>
    </relationships>
</table>
